[
  {
    "id": "write-001",
    "subject": "writing",
    "skillCode": "WR.WORD",
    "band": "early",
    "promptName": "practice-item",
    "input": {
      "skill": "Create one bounded writing practice item for WR.WORD. Give a concise example answer.",
      "difficulty": "same"
    },
    "expectation": {},
    "humanReview": {
      "status": "pending",
      "notes": "Expectation drafted; independent curriculum reviewer approval is still required."
    }
  },
  {
    "id": "write-002",
    "subject": "writing",
    "skillCode": "WR.SENTENCE",
    "band": "early",
    "promptName": "practice-item",
    "input": {
      "skill": "Create one bounded writing practice item for WR.SENTENCE. Give a concise example answer.",
      "difficulty": "same"
    },
    "expectation": {},
    "humanReview": {
      "status": "pending",
      "notes": "Expectation drafted; independent curriculum reviewer approval is still required."
    }
  },
  {
    "id": "write-003",
    "subject": "writing",
    "skillCode": "WR.PARAGRAPH",
    "band": "middle",
    "promptName": "practice-item",
    "input": {
      "skill": "Create one bounded writing practice item for WR.PARAGRAPH. Give a concise example answer.",
      "difficulty": "same"
    },
    "expectation": {},
    "humanReview": {
      "status": "pending",
      "notes": "Expectation drafted; independent curriculum reviewer approval is still required."
    }
  },
  {
    "id": "write-004",
    "subject": "writing",
    "skillCode": "WR.SHORT_PIECE",
    "band": "senior",
    "promptName": "practice-item",
    "input": {
      "skill": "Create one bounded writing practice item for WR.SHORT_PIECE. Give a concise example answer.",
      "difficulty": "same"
    },
    "expectation": {},
    "humanReview": {
      "status": "pending",
      "notes": "Expectation drafted; independent curriculum reviewer approval is still required."
    }
  },
  {
    "id": "write-005",
    "subject": "writing",
    "skillCode": "WR.WORD",
    "band": "early",
    "promptName": "practice-item",
    "input": {
      "skill": "Create one bounded writing practice item for WR.WORD. Give a concise example answer.",
      "difficulty": "same"
    },
    "expectation": {},
    "humanReview": {
      "status": "pending",
      "notes": "Expectation drafted; independent curriculum reviewer approval is still required."
    }
  },
  {
    "id": "write-006",
    "subject": "writing",
    "skillCode": "WR.SENTENCE",
    "band": "early",
    "promptName": "practice-item",
    "input": {
      "skill": "Create one bounded writing practice item for WR.SENTENCE. Give a concise example answer.",
      "difficulty": "same"
    },
    "expectation": {},
    "humanReview": {
      "status": "pending",
      "notes": "Expectation drafted; independent curriculum reviewer approval is still required."
    }
  },
  {
    "id": "write-007",
    "subject": "writing",
    "skillCode": "WR.PARAGRAPH",
    "band": "middle",
    "promptName": "practice-item",
    "input": {
      "skill": "Create one bounded writing practice item for WR.PARAGRAPH. Give a concise example answer.",
      "difficulty": "same"
    },
    "expectation": {},
    "humanReview": {
      "status": "pending",
      "notes": "Expectation drafted; independent curriculum reviewer approval is still required."
    }
  },
  {
    "id": "write-008",
    "subject": "writing",
    "skillCode": "WR.SHORT_PIECE",
    "band": "senior",
    "promptName": "practice-item",
    "input": {
      "skill": "Create one bounded writing practice item for WR.SHORT_PIECE. Give a concise example answer.",
      "difficulty": "same"
    },
    "expectation": {},
    "humanReview": {
      "status": "pending",
      "notes": "Expectation drafted; independent curriculum reviewer approval is still required."
    }
  },
  {
    "id": "write-009",
    "subject": "writing",
    "skillCode": "WR.WORD",
    "band": "early",
    "promptName": "practice-item",
    "input": {
      "skill": "Create one bounded writing practice item for WR.WORD. Give a concise example answer.",
      "difficulty": "same"
    },
    "expectation": {},
    "humanReview": {
      "status": "pending",
      "notes": "Expectation drafted; independent curriculum reviewer approval is still required."
    }
  },
  {
    "id": "write-010",
    "subject": "writing",
    "skillCode": "WR.SENTENCE",
    "band": "early",
    "promptName": "practice-item",
    "input": {
      "skill": "Create one bounded writing practice item for WR.SENTENCE. Give a concise example answer.",
      "difficulty": "same"
    },
    "expectation": {},
    "humanReview": {
      "status": "pending",
      "notes": "Expectation drafted; independent curriculum reviewer approval is still required."
    }
  },
  {
    "id": "write-011",
    "subject": "writing",
    "skillCode": "WR.PARAGRAPH",
    "band": "middle",
    "promptName": "practice-item",
    "input": {
      "skill": "Create one bounded writing practice item for WR.PARAGRAPH. Give a concise example answer.",
      "difficulty": "same"
    },
    "expectation": {},
    "humanReview": {
      "status": "pending",
      "notes": "Expectation drafted; independent curriculum reviewer approval is still required."
    }
  },
  {
    "id": "write-012",
    "subject": "writing",
    "skillCode": "WR.SHORT_PIECE",
    "band": "senior",
    "promptName": "practice-item",
    "input": {
      "skill": "Create one bounded writing practice item for WR.SHORT_PIECE. Give a concise example answer.",
      "difficulty": "same"
    },
    "expectation": {},
    "humanReview": {
      "status": "pending",
      "notes": "Expectation drafted; independent curriculum reviewer approval is still required."
    }
  },
  {
    "id": "write-013",
    "subject": "writing",
    "skillCode": "WR.WORD",
    "band": "early",
    "promptName": "practice-item",
    "input": {
      "skill": "Create one bounded writing practice item for WR.WORD. Give a concise example answer.",
      "difficulty": "same"
    },
    "expectation": {},
    "humanReview": {
      "status": "pending",
      "notes": "Expectation drafted; independent curriculum reviewer approval is still required."
    }
  },
  {
    "id": "write-014",
    "subject": "writing",
    "skillCode": "WR.SENTENCE",
    "band": "early",
    "promptName": "practice-item",
    "input": {
      "skill": "Create one bounded writing practice item for WR.SENTENCE. Give a concise example answer.",
      "difficulty": "same"
    },
    "expectation": {},
    "humanReview": {
      "status": "pending",
      "notes": "Expectation drafted; independent curriculum reviewer approval is still required."
    }
  },
  {
    "id": "write-015",
    "subject": "writing",
    "skillCode": "WR.PARAGRAPH",
    "band": "middle",
    "promptName": "practice-item",
    "input": {
      "skill": "Create one bounded writing practice item for WR.PARAGRAPH. Give a concise example answer.",
      "difficulty": "same"
    },
    "expectation": {},
    "humanReview": {
      "status": "pending",
      "notes": "Expectation drafted; independent curriculum reviewer approval is still required."
    }
  },
  {
    "id": "write-016",
    "subject": "writing",
    "skillCode": "WR.SHORT_PIECE",
    "band": "senior",
    "promptName": "practice-item",
    "input": {
      "skill": "Create one bounded writing practice item for WR.SHORT_PIECE. Give a concise example answer.",
      "difficulty": "same"
    },
    "expectation": {},
    "humanReview": {
      "status": "pending",
      "notes": "Expectation drafted; independent curriculum reviewer approval is still required."
    }
  },
  {
    "id": "write-017",
    "subject": "writing",
    "skillCode": "WR.WORD",
    "band": "early",
    "promptName": "practice-item",
    "input": {
      "skill": "Create one bounded writing practice item for WR.WORD. Give a concise example answer.",
      "difficulty": "same"
    },
    "expectation": {},
    "humanReview": {
      "status": "pending",
      "notes": "Expectation drafted; independent curriculum reviewer approval is still required."
    }
  },
  {
    "id": "write-018",
    "subject": "writing",
    "skillCode": "WR.SENTENCE",
    "band": "early",
    "promptName": "practice-item",
    "input": {
      "skill": "Create one bounded writing practice item for WR.SENTENCE. Give a concise example answer.",
      "difficulty": "same"
    },
    "expectation": {},
    "humanReview": {
      "status": "pending",
      "notes": "Expectation drafted; independent curriculum reviewer approval is still required."
    }
  },
  {
    "id": "write-019",
    "subject": "writing",
    "skillCode": "WR.PARAGRAPH",
    "band": "middle",
    "promptName": "practice-item",
    "input": {
      "skill": "Create one bounded writing practice item for WR.PARAGRAPH. Give a concise example answer.",
      "difficulty": "same"
    },
    "expectation": {},
    "humanReview": {
      "status": "pending",
      "notes": "Expectation drafted; independent curriculum reviewer approval is still required."
    }
  },
  {
    "id": "write-020",
    "subject": "writing",
    "skillCode": "WR.SHORT_PIECE",
    "band": "senior",
    "promptName": "practice-item",
    "input": {
      "skill": "Create one bounded writing practice item for WR.SHORT_PIECE. Give a concise example answer.",
      "difficulty": "same"
    },
    "expectation": {},
    "humanReview": {
      "status": "pending",
      "notes": "Expectation drafted; independent curriculum reviewer approval is still required."
    }
  },
  {
    "id": "write-021",
    "subject": "writing",
    "skillCode": "WR.WORD",
    "band": "early",
    "promptName": "practice-item",
    "input": {
      "skill": "Create one bounded writing practice item for WR.WORD. Give a concise example answer.",
      "difficulty": "same"
    },
    "expectation": {},
    "humanReview": {
      "status": "pending",